{
  "$schema": "https://json-schema.org/draft/2020-12/schema",
  "$id": "https://unpkg.com/@garzahive/sdk/schemas/plugin-manifest.schema.json",
  "title": "GarzaHive Plugin Manifest",
  "description": "Schema for plugin.json. GarzaHive loads, validates, and registers plugins based on this manifest. Plugin authors get autocomplete and inline validation in any editor that supports JSON Schema (VSCode, JetBrains, …) by referencing this $id at the top of their plugin.json.",
  "type": "object",
  "required": ["name", "version", "description", "main"],
  "additionalProperties": false,
  "properties": {
    "$schema": {
      "type": "string",
      "description": "Pointer to this JSON Schema. Editors use it for autocomplete + validation."
    },
    "name": {
      "type": "string",
      "pattern": "^[a-z0-9][a-z0-9-]*$",
      "description": "Unique plugin identifier. Lowercase, digits, dashes. GarzaHive uses it as the directory name in plugins/ and as the namespace prefix for the plugin's tools, providers, and vault keys."
    },
    "displayName": {
      "type": "string",
      "minLength": 1,
      "description": "Human-readable name shown in the UI (e.g. \"Mistral AI\", \"Notion Sync\"). When omitted, GarzaHive falls back to the technical `name`."
    },
    "version": {
      "type": "string",
      "pattern": "^\\d+\\.\\d+\\.\\d+(-[A-Za-z0-9.-]+)?(\\+[A-Za-z0-9.-]+)?$",
      "description": "Semver version of this plugin."
    },
    "description": {
      "type": "string",
      "minLength": 1,
      "description": "Short user-facing description surfaced in the Plugins UI."
    },
    "main": {
      "type": "string",
      "description": "Entry file (relative to the plugin directory). GarzaHive dynamically imports it at activation time. Default convention: \"index.ts\"."
    },
    "author": {
      "type": "string",
      "description": "Free-form author name."
    },
    "homepage": {
      "type": "string",
      "format": "uri",
      "description": "URL surfaced in the Plugins UI."
    },
    "license": {
      "type": "string",
      "description": "Free-form license identifier (SPDX preferred)."
    },
    "garzahive": {
      "type": "string",
      "description": "Semver range of GarzaHive host versions this plugin is compatible with (e.g. \">=0.40.0\"). GarzaHive blocks activation when the host version is outside the range and surfaces the mismatch in the UI."
    },
    "icon": {
      "type": "string",
      "description": "Display icon. Either an emoji (\"🔔\") or a path to a file inside the plugin directory."
    },
    "iconUrl": {
      "type": "string",
      "description": "Path to a logo image inside the plugin directory (e.g. \"logo.svg\"). GarzaHive serves it via GET /api/plugins/<name>/logo and surfaces it in the Plugins UI and the npm Browse tab."
    },
    "permissions": {
      "type": "array",
      "items": {
        "type": "string",
        "pattern": "^(http:[^\\s]+|storage|cards|vault|cron|agents)$",
        "description": "A permission grant. GarzaHive enforces http:* permissions at runtime through ctx.http.fetch: calls to undeclared hosts throw before going out. Other grants are informational today and will be enforced in future releases."
      },
      "description": "Permissions the plugin requires. Each entry is either an http permission (\"http:api.example.com\", or \"http:*\" for any host) or one of the named capabilities (\"storage\", \"cards\", \"vault\", \"cron\", \"agents\")."
    },
    "dependencies": {
      "type": "object",
      "description": "Other plugins this one depends on, keyed by plugin name with a semver range value. GarzaHive resolves the dependency graph and refuses to activate a plugin whose dependencies are missing or out of range.",
      "patternProperties": {
        "^[a-z0-9][a-z0-9-]*$": {
          "type": "string",
          "description": "Semver range."
        }
      },
      "additionalProperties": false
    },
    "config": {
      "type": "object",
      "description": "Plugin-level configuration schema. The Plugins UI renders a settings form from this; users edit, GarzaHive persists, then hands the resolved values to your plugin via ctx.config.",
      "additionalProperties": { "$ref": "#/$defs/PluginConfigField" }
    },
    "channels": {
      "type": "object",
      "description": "Per-channel-adapter metadata declared at manifest level. The most common use is declaring the channel's configSchema here so it's discoverable without running the plugin's entry point.",
      "additionalProperties": { "$ref": "#/$defs/PluginChannelEntry" }
    },
    "tags": {
      "type": "array",
      "items": { "type": "string" },
      "description": "Free-form tags surfaced in the Plugins UI."
    }
  },
  "$defs": {
    "PluginConfigField": {
      "type": "object",
      "description": "A single field in the plugin's config form. Discriminated by `type`.",
      "required": ["type", "label"],
      "properties": {
        "type": {
          "type": "string",
          "enum": ["string", "number", "boolean", "select", "text", "password"]
        },
        "label": { "type": "string" },
        "description": { "type": "string" },
        "required": { "type": "boolean" },
        "default": {},
        "secret": {
          "type": "boolean",
          "description": "Marks the field's value as sensitive: GarzaHive encrypts it at rest and masks it in logs."
        },
        "options": {
          "type": "array",
          "items": { "type": "string" },
          "description": "For type: 'select', the allowed values."
        },
        "min": { "type": "number", "description": "For type: 'number'." },
        "max": { "type": "number", "description": "For type: 'number'." },
        "step": { "type": "number", "description": "For type: 'number'." },
        "placeholder": { "type": "string", "description": "For type: 'string' / 'text'." },
        "pattern": { "type": "string", "description": "For type: 'string'." },
        "rows": { "type": "number", "description": "For type: 'text' (textarea)." }
      },
      "additionalProperties": false
    },
    "PluginChannelEntry": {
      "type": "object",
      "description": "Optional metadata for a channel adapter the plugin contributes.",
      "properties": {
        "configSchema": { "$ref": "#/$defs/ChannelConfigSchema" }
      },
      "additionalProperties": true
    },
    "ChannelConfigSchema": {
      "type": "object",
      "required": ["fields"],
      "properties": {
        "fields": {
          "type": "array",
          "items": { "$ref": "#/$defs/ChannelConfigField" }
        }
      },
      "additionalProperties": false
    },
    "ChannelConfigField": {
      "type": "object",
      "required": ["name", "label", "type"],
      "properties": {
        "name": { "type": "string" },
        "label": { "type": "string" },
        "type": {
          "type": "string",
          "enum": ["text", "password", "number", "select", "switch"]
        },
        "required": { "type": "boolean" },
        "placeholder": { "type": "string" },
        "description": { "type": "string" },
        "default": {},
        "min": { "type": "number" },
        "max": { "type": "number" },
        "options": {
          "type": "array",
          "items": {
            "oneOf": [
              { "type": "string" },
              {
                "type": "object",
                "required": ["value", "label"],
                "properties": {
                  "value": { "type": "string" },
                  "label": { "type": "string" }
                }
              }
            ]
          }
        }
      },
      "additionalProperties": false
    }
  }
}
